{
  "$schema": "http://pathways-library.rmi.org/schema/pathwayTimeseries.v1.json",
  "id": "ACE-BAS-2024_TS",
  "name": "Baseline Scenario (BAS) Timeseries Data",
  "description": "Continuation of historical trends of ASEAN energy systems w/o modelling of existing policy targets.",
  "publisher": "ASEAN Centre for Energy (ACE)",
  "publicationName": "8th ASEAN Energy Outlook",
  "publicationYear": 2024,
  "pathwayName": "Baseline Scenario (BAS)",
  "source": "ACE (2024). 8th ASEAN Energy Outlook (AEO8). ASEAN Centre for Energy (ACE), Jakarta. Available for download\nfrom https://aseanenergy.org/.",
  "emissionsScope": "No information",
  "sector": {
    "power": {
      "displayName": "Power",
      "technology": {
        "coal": {
          "displayName": "Coal",
          "definition": "Electricity generation using coal combustion to produce steam that drives turbines for power."
        },
        "oil": {
          "displayName": "Oil",
          "definition": "Electricity generation using petroleum-based fuels (diesel, heavy oil) to drive engines or steam turbines."
        },
        "gas": {
          "displayName": "Gas",
          "definition": "Electricity generation using natural gas combustion in turbines or combined-cycle plants."
        },
        "nuclear": {
          "displayName": "Nuclear",
          "definition": "Electricity generation using heat from controlled nuclear fission reactors to produce steam."
        },
        "hydro": {
          "displayName": "Hydro",
          "definition": "Electricity generation using flowing or falling water from rivers or dams to drive turbines (includes large and small sites, excludes pumped storage)."
        },
        "wind": {
          "displayName": "Wind",
          "definition": "Electricity generation via wind turbines, both onshore and offshore."
        },
        "solar": {
          "displayName": "Solar",
          "definition": "Electricity generation via photovoltaic cells that convert sunlight directly into electricity."
        },
        "biomass": {
          "displayName": "Biomass",
          "definition": "Electricity generation using organic materials (biomass, biogas, or waste) as fuel for combustion or steam turbines."
        },
        "other": {
          "displayName": "Other",
          "definition": "Electricity generation using alternative or emerging sources such as geothermal, tidal, or hydrogen."
        }
      },
      "metric": {
        "capacity": {
          "displayName": "Capacity",
          "definition": "The maximum output a power plant or energy source can produce under ideal conditions, measured in GW",
          "sectorScope": "Power generation"
        },
        "generation": {
          "displayName": "Generation",
          "definition": "The actual amount of electricity produced over a specific period, typically measured in TWh",
          "sectorScope": "Power generation"
        },
        "emissionsIntensity": {
          "displayName": "Emissions Intensity",
          "definition": "Amount of greenhouse gases emitted per unit of physical output. Indicates how low-carbon the output production is",
          "sectorScope": "Power generation"
        },
        "absoluteEmissions": {
          "displayName": "Absolute Emissions",
          "definition": "Total greenhouse gas emissions produced, regardless of output. Measured in metric tons of COâ‚‚ equivalent",
          "sectorScope": "Power generation"
        },
        "technologyMix": {
          "displayName": "Technology Mix",
          "definition": "The breakdown of energy sources used for electricity generation (e.g., coal, solar, wind, nuclear). Reflects the diversity and sustainability of the energy portfolio",
          "sectorScope": "Power generation"
        }
      }
    }
  },
  "data": [
    {
      "year": 2022,
      "geography": "South East Asia",
      "sector": "Power",
      "technology": "Coal",
      "metric": "Capacity",
      "value": 107.1,
      "unit": "GW"
    },
    {
      "year": 2025,
      "geography": "South East Asia",
      "sector": "Power",
      "technology": "Coal",
      "metric": "Capacity",
      "value": 114.4,
      "unit": "GW"
    },
    {
      "year": 2030,
      "geography": "South East Asia",
      "sector": "Power",
      "technology": "Coal",
      "metric": "Capacity",
      "value": 137.1,
      "unit": "GW"
    },
    {
      "year": 2035,
      "geography": "South East Asia",
      "sector": "Power",
      "technology": "Coal",
      "metric": "Capacity",
      "value": 158.6,
      "unit": "GW"
    },
    {
      "year": 2040,
      "geography": "South East Asia",
      "sector": "Power",
      "technology": "Coal",
      "metric": "Capacity",
      "value": 181.6,
      "unit": "GW"
    },
    {
      "year": 2045,
      "geography": "South East Asia",
      "sector": "Power",
      "technology": "Coal",
      "metric": "Capacity",
      "value": 211.2,
      "unit": "GW"
    },
    {
      "year": 2050,
      "geography": "South East Asia",
      "sector": "Power",
      "technology": "Coal",
      "metric": "Capacity",
      "value": 235.7,
      "unit": "GW"
    },
    {
      "year": 2022,
      "geography": "South East Asia",
      "sector": "Power",
      "technology": "Oil",
      "metric": "Capacity",
      "value": 12.5,
      "unit": "GW"
    },
    {
      "year": 2025,
      "geography": "South East Asia",
      "sector": "Power",
      "technology": "Oil",
      "metric": "Capacity",
      "value": 12.9,
      "unit": "GW"
    },
    {
      "year": 2030,
      "geography": "South East Asia",
      "sector": "Power",
      "technology": "Oil",
      "metric": "Capacity",
      "value": 14.2,
      "unit": "GW"
    },
    {
      "year": 2035,
      "geography": "South East Asia",
      "sector": "Power",
      "technology": "Oil",
      "metric": "Capacity",
      "value": 15.7,
      "unit": "GW"
    },
    {
      "year": 2040,
      "geography": "South East Asia",
      "sector": "Power",
      "technology": "Oil",
      "metric": "Capacity",
      "value": 17.4,
      "unit": "GW"
    },
    {
      "year": 2045,
      "geography": "South East Asia",
      "sector": "Power",
      "technology": "Oil",
      "metric": "Capacity",
      "value": 19.4,
      "unit": "GW"
    },
    {
      "year": 2050,
      "geography": "South East Asia",
      "sector": "Power",
      "technology": "Oil",
      "metric": "Capacity",
      "value": 21.2,
      "unit": "GW"
    },
    {
      "year": 2022,
      "geography": "South East Asia",
      "sector": "Power",
      "technology": "Gas",
      "metric": "Capacity",
      "value": 89.9,
      "unit": "GW"
    },
    {
      "year": 2025,
      "geography": "South East Asia",
      "sector": "Power",
      "technology": "Gas",
      "metric": "Capacity",
      "value": 98.4,
      "unit": "GW"
    },
    {
      "year": 2030,
      "geography": "South East Asia",
      "sector": "Power",
      "technology": "Gas",
      "metric": "Capacity",
      "value": 126.9,
      "unit": "GW"
    },
    {
      "year": 2035,
      "geography": "South East Asia",
      "sector": "Power",
      "technology": "Gas",
      "metric": "Capacity",
      "value": 154.5,
      "unit": "GW"
    },
    {
      "year": 2040,
      "geography": "South East Asia",
      "sector": "Power",
      "technology": "Gas",
      "metric": "Capacity",
      "value": 183.8,
      "unit": "GW"
    },
    {
      "year": 2045,
      "geography": "South East Asia",
      "sector": "Power",
      "technology": "Gas",
      "metric": "Capacity",
      "value": 219.3,
      "unit": "GW"
    },
    {
      "year": 2050,
      "geography": "South East Asia",
      "sector": "Power",
      "technology": "Gas",
      "metric": "Capacity",
      "value": 251.1,
      "unit": "GW"
    },
    {
      "year": 2022,
      "geography": "South East Asia",
      "sector": "Power",
      "technology": "Hydro",
      "metric": "Capacity",
      "value": 62.3,
      "unit": "GW"
    },
    {
      "year": 2025,
      "geography": "South East Asia",
      "sector": "Power",
      "technology": "Hydro",
      "metric": "Capacity",
      "value": 69.2,
      "unit": "GW"
    },
    {
      "year": 2030,
      "geography": "South East Asia",
      "sector": "Power",
      "technology": "Hydro",
      "metric": "Capacity",
      "value": 88.4,
      "unit": "GW"
    },
    {
      "year": 2035,
      "geography": "South East Asia",
      "sector": "Power",
      "technology": "Hydro",
      "metric": "Capacity",
      "value": 104.3,
      "unit": "GW"
    },
    {
      "year": 2040,
      "geography": "South East Asia",
      "sector": "Power",
      "technology": "Hydro",
      "metric": "Capacity",
      "value": 118.7,
      "unit": "GW"
    },
    {
      "year": 2045,
      "geography": "South East Asia",
      "sector": "Power",
      "technology": "Hydro",
      "metric": "Capacity",
      "value": 137.5,
      "unit": "GW"
    },
    {
      "year": 2050,
      "geography": "South East Asia",
      "sector": "Power",
      "technology": "Hydro",
      "metric": "Capacity",
      "value": 153.8,
      "unit": "GW"
    },
    {
      "year": 2022,
      "geography": "South East Asia",
      "sector": "Power",
      "technology": "Wind",
      "metric": "Capacity",
      "value": 7.2,
      "unit": "GW"
    },
    {
      "year": 2025,
      "geography": "South East Asia",
      "sector": "Power",
      "technology": "Wind",
      "metric": "Capacity",
      "value": 8.1,
      "unit": "GW"
    },
    {
      "year": 2030,
      "geography": "South East Asia",
      "sector": "Power",
      "technology": "Wind",
      "metric": "Capacity",
      "value": 11.3,
      "unit": "GW"
    },
    {
      "year": 2035,
      "geography": "South East Asia",
      "sector": "Power",
      "technology": "Wind",
      "metric": "Capacity",
      "value": 15.4,
      "unit": "GW"
    },